{"canonical_format":"lfv-canonical-json-v1","cegis_digest":{"algorithm":"sha256","digest":"1c50d62379cf60610c7e1d14e29be624d28746ea13eee102a053d3b59bc1941b","schema_id":"lfv-workflow-evidence-cegis-digest-v1"},"channels":[{"cost":{"operational":2,"privacy":0,"trust":0},"deployed":true,"description":"The researcher-visible declaration, publication, and anchoring history.","id":"selfReport","visible_actions":["declareBaseline","publishResult","anchorLedger"],"visible_state":["baselineDeclared","resultPublished","ledgerAnchored"],"weighted_cost":2},{"cost":{"operational":1,"privacy":0,"trust":0},"deployed":true,"description":"Canonical artifacts for the selected result.","id":"resultBundle","visible_actions":["publishResult"],"visible_state":["resultPublished"],"weighted_cost":1},{"cost":{"operational":1,"privacy":0,"trust":2},"deployed":true,"description":"A valid RFC 3161 timestamp over the researcher-visible ledger.","id":"rfc3161Anchor","visible_actions":["anchorLedger"],"visible_state":["ledgerAnchored"],"weighted_cost":3},{"cost":{"operational":4,"privacy":2,"trust":0},"deployed":false,"description":"An independent log revealing every execution and sensitive data-access event.","id":"fullExecutorLog","visible_actions":["executeBaseline","executeHiddenSweep","readFutureData"],"visible_state":[],"weighted_cost":6},{"cost":{"operational":2,"privacy":0,"trust":0},"deployed":false,"description":"A narrow independent receipt for one specifically instrumented adversarial action. Action: Execute an unreported parameter sweep before publishing the baseline.","generated_from":"targetedReceipt:action:executeHiddenSweep","id":"targetedReceipt_executeHiddenSweep","visible_actions":["executeHiddenSweep"],"visible_state":[],"weighted_cost":2},{"cost":{"operational":2,"privacy":0,"trust":0},"deployed":false,"description":"A narrow independent receipt for one specifically instrumented adversarial action. Action: Read a future data revision unavailable at the decision time.","generated_from":"targetedReceipt:action:readFutureData","id":"targetedReceipt_readFutureData","visible_actions":["readFutureData"],"visible_state":[],"weighted_cost":2},{"cost":{"operational":2,"privacy":0,"trust":0},"deployed":false,"description":"A narrow independent receipt for one specifically instrumented adversarial action. Action: Alter the cost model after execution while leaving the researcher-visible declaration unchanged.","generated_from":"targetedReceipt:action:tamperCostModel","id":"targetedReceipt_tamperCostModel","visible_actions":["tamperCostModel"],"visible_state":[],"weighted_cost":2}],"deployment_analysis":{"deployed_but_globally_redundant":["resultBundle","rfc3161Anchor"],"global_optimal_but_not_in_repair":[],"global_optimal_selection":["selfReport","targetedReceipt_executeHiddenSweep","targetedReceipt_readFutureData","targetedReceipt_tamperCostModel"],"minimum_incremental_repair":["targetedReceipt_executeHiddenSweep","targetedReceipt_readFutureData","targetedReceipt_tamperCostModel"]},"evidence_model":{"channels":[{"cost":{"operational":2,"privacy":0,"trust":0},"description":"The researcher-visible declaration, publication, and anchoring history.","id":"selfReport","observations":{"costModelTampering":{"actions":["declareBaseline","publishResult","anchorLedger"],"state":[true,true,true]},"dualAttack":{"actions":["declareBaseline","publishResult","anchorLedger"],"state":[true,true,true]},"futureLeak":{"actions":["declareBaseline","publishResult","anchorLedger"],"state":[true,true,true]},"hiddenSweep":{"actions":["declareBaseline","publishResult","anchorLedger"],"state":[true,true,true]},"history10":{"actions":["publishResult","anchorLedger"],"state":[false,true,true]},"history11":{"actions":["publishResult","anchorLedger"],"state":[false,true,true]},"history12":{"actions":["publishResult","anchorLedger"],"state":[false,true,true]},"history13":{"actions":["publishResult","anchorLedger"],"state":[false,true,true]},"history15":{"actions":["declareBaseline","publishResult","anchorLedger"],"state":[true,true,true]},"history16":{"actions":["declareBaseline","publishResult","anchorLedger"],"state":[true,true,true]},"history17":{"actions":["declareBaseline","publishResult","anchorLedger"],"state":[true,true,true]},"history18":{"actions":["declareBaseline","publishResult","anchorLedger"],"state":[true,true,true]},"history19":{"actions":["declareBaseline","publishResult","anchorLedger"],"state":[true,true,true]},"history2":{"actions":["publishResult","anchorLedger"],"state":[false,true,true]},"history20":{"actions":["publishResult","anchorLedger"],"state":[false,true,true]},"history21":{"actions":["publishResult","anchorLedger"],"state":[false,true,true]},"history22":{"actions":["publishResult","anchorLedger"],"state":[false,true,true]},"history23":{"actions":["publishResult","anchorLedger"],"state":[false,true,true]},"history24":{"actions":["publishResult","anchorLedger"],"state":[false,true,true]},"history25":{"actions":["publishResult","anchorLedger"],"state":[false,true,true]},"history26":{"actions":["declareBaseline","publishResult","anchorLedger"],"state":[true,true,true]},"history27":{"actions":["declareBaseline","publishResult","anchorLedger"],"state":[true,true,true]},"history28":{"actions":["declareBaseline","publishResult","anchorLedger"],"state":[true,true,true]},"history29":{"actions":["declareBaseline","publishResult","anchorLedger"],"state":[true,true,true]},"history3":{"actions":["publishResult","anchorLedger"],"state":[false,true,true]},"history30":{"actions":["declareBaseline","publishResult","anchorLedger"],"state":[true,true,true]},"history31":{"actions":["declareBaseline","publishResult","anchorLedger"],"state":[true,true,true]},"history4":{"actions":["publishResult","anchorLedger"],"state":[false,true,true]},"history8":{"actions":["publishResult","anchorLedger"],"state":[false,true,true]},"history9":{"actions":["publishResult","anchorLedger"],"state":[false,true,true]},"honest":{"actions":["declareBaseline","publishResult","anchorLedger"],"state":[true,true,true]},"undeclaredBaseline":{"actions":["publishResult","anchorLedger"],"state":[false,true,true]}}},{"cost":{"operational":1,"privacy":0,"trust":0},"description":"Canonical artifacts for the selected result.","id":"resultBundle","observations":{"costModelTampering":{"actions":["publishResult"],"state":[true]},"dualAttack":{"actions":["publishResult"],"state":[true]},"futureLeak":{"actions":["publishResult"],"state":[true]},"hiddenSweep":{"actions":["publishResult"],"state":[true]},"history10":{"actions":["publishResult"],"state":[true]},"history11":{"actions":["publishResult"],"state":[true]},"history12":{"actions":["publishResult"],"state":[true]},"history13":{"actions":["publishResult"],"state":[true]},"history15":{"actions":["publishResult"],"state":[true]},"history16":{"actions":["publishResult"],"state":[true]},"history17":{"actions":["publishResult"],"state":[true]},"history18":{"actions":["publishResult"],"state":[true]},"history19":{"actions":["publishResult"],"state":[true]},"history2":{"actions":["publishResult"],"state":[true]},"history20":{"actions":["publishResult"],"state":[true]},"history21":{"actions":["publishResult"],"state":[true]},"history22":{"actions":["publishResult"],"state":[true]},"history23":{"actions":["publishResult"],"state":[true]},"history24":{"actions":["publishResult"],"state":[true]},"history25":{"actions":["publishResult"],"state":[true]},"history26":{"actions":["publishResult"],"state":[true]},"history27":{"actions":["publishResult"],"state":[true]},"history28":{"actions":["publishResult"],"state":[true]},"history29":{"actions":["publishResult"],"state":[true]},"history3":{"actions":["publishResult"],"state":[true]},"history30":{"actions":["publishResult"],"state":[true]},"history31":{"actions":["publishResult"],"state":[true]},"history4":{"actions":["publishResult"],"state":[true]},"history8":{"actions":["publishResult"],"state":[true]},"history9":{"actions":["publishResult"],"state":[true]},"honest":{"actions":["publishResult"],"state":[true]},"undeclaredBaseline":{"actions":["publishResult"],"state":[true]}}},{"cost":{"operational":1,"privacy":0,"trust":2},"description":"A valid RFC 3161 timestamp over the researcher-visible ledger.","id":"rfc3161Anchor","observations":{"costModelTampering":{"actions":["anchorLedger"],"state":[true]},"dualAttack":{"actions":["anchorLedger"],"state":[true]},"futureLeak":{"actions":["anchorLedger"],"state":[true]},"hiddenSweep":{"actions":["anchorLedger"],"state":[true]},"history10":{"actions":["anchorLedger"],"state":[true]},"history11":{"actions":["anchorLedger"],"state":[true]},"history12":{"actions":["anchorLedger"],"state":[true]},"history13":{"actions":["anchorLedger"],"state":[true]},"history15":{"actions":["anchorLedger"],"state":[true]},"history16":{"actions":["anchorLedger"],"state":[true]},"history17":{"actions":["anchorLedger"],"state":[true]},"history18":{"actions":["anchorLedger"],"state":[true]},"history19":{"actions":["anchorLedger"],"state":[true]},"history2":{"actions":["anchorLedger"],"state":[true]},"history20":{"actions":["anchorLedger"],"state":[true]},"history21":{"actions":["anchorLedger"],"state":[true]},"history22":{"actions":["anchorLedger"],"state":[true]},"history23":{"actions":["anchorLedger"],"state":[true]},"history24":{"actions":["anchorLedger"],"state":[true]},"history25":{"actions":["anchorLedger"],"state":[true]},"history26":{"actions":["anchorLedger"],"state":[true]},"history27":{"actions":["anchorLedger"],"state":[true]},"history28":{"actions":["anchorLedger"],"state":[true]},"history29":{"actions":["anchorLedger"],"state":[true]},"history3":{"actions":["anchorLedger"],"state":[true]},"history30":{"actions":["anchorLedger"],"state":[true]},"history31":{"actions":["anchorLedger"],"state":[true]},"history4":{"actions":["anchorLedger"],"state":[true]},"history8":{"actions":["anchorLedger"],"state":[true]},"history9":{"actions":["anchorLedger"],"state":[true]},"